{
  "schemaVersion": 1,
  "gate": "R0",
  "commit": "f212d195b4cd968a105dac9e22d147f2bbd96965",
  "dirty": false,
  "robinVersion": "0.0.0",
  "dependencyLockSha256": "548f3f667074690ced9f435f6afba3565673755330598e5682e064ea88702791",
  "environment": [
    {
      "name": "platform",
      "value": "darwin"
    },
    {
      "name": "arch",
      "value": "arm64"
    },
    {
      "name": "node",
      "value": "v26.7.0"
    },
    {
      "name": "npm",
      "value": "11.19.0"
    },
    {
      "name": "git",
      "value": "git version 2.43.1"
    },
    {
      "name": "commandIsolation",
      "value": "macos-sandbox-exec-source-deny"
    }
  ],
  "commands": [
    {
      "id": "dependency-install",
      "executable": "npm",
      "args": [
        "ci",
        "--ignore-scripts",
        "--silent",
        "--no-audit",
        "--no-fund"
      ],
      "display": "[\"npm\",\"ci\",\"--ignore-scripts\",\"--silent\",\"--no-audit\",\"--no-fund\"]",
      "timeoutMs": 900000,
      "exitCode": 0,
      "signal": null,
      "status": "passed",
      "observedDurationMs": 815,
      "durationVerification": {
        "mode": "replay-envelope-v1",
        "factor": 4,
        "slackMs": 1000
      },
      "stdout": {
        "observed": {
          "bytes": 0,
          "sha256": "e3b0c44298fc1c149afbf4c8996fb92427ae41e4649b934ca495991b7852b855"
        },
        "replay": {
          "normalization": "ascii-digit-runs-v1",
          "bytes": 0,
          "sha256": "e3b0c44298fc1c149afbf4c8996fb92427ae41e4649b934ca495991b7852b855"
        }
      },
      "stderr": {
        "observed": {
          "bytes": 0,
          "sha256": "e3b0c44298fc1c149afbf4c8996fb92427ae41e4649b934ca495991b7852b855"
        },
        "replay": {
          "normalization": "ascii-digit-runs-v1",
          "bytes": 0,
          "sha256": "e3b0c44298fc1c149afbf4c8996fb92427ae41e4649b934ca495991b7852b855"
        }
      },
      "summary": "passed; observed duration=815ms; stdout=0 bytes; stderr=0 bytes"
    },
    {
      "id": "dependency-tree",
      "executable": "npm",
      "args": [
        "ls",
        "--all",
        "--json"
      ],
      "display": "[\"npm\",\"ls\",\"--all\",\"--json\"]",
      "timeoutMs": 300000,
      "exitCode": 0,
      "signal": null,
      "status": "passed",
      "observedDurationMs": 178,
      "durationVerification": {
        "mode": "replay-envelope-v1",
        "factor": 4,
        "slackMs": 1000
      },
      "stdout": {
        "observed": {
          "bytes": 10981,
          "sha256": "b3cec8958c5a6c1d77c6a52dde7900565e55625f072b77d07ba21fef0b47018f"
        },
        "replay": {
          "normalization": "ascii-digit-runs-v1",
          "bytes": 10950,
          "sha256": "71aac318dcf3f9e221741155536c4cebecf096b0664a5886238b8a74e4ff8c16"
        }
      },
      "stderr": {
        "observed": {
          "bytes": 0,
          "sha256": "e3b0c44298fc1c149afbf4c8996fb92427ae41e4649b934ca495991b7852b855"
        },
        "replay": {
          "normalization": "ascii-digit-runs-v1",
          "bytes": 0,
          "sha256": "e3b0c44298fc1c149afbf4c8996fb92427ae41e4649b934ca495991b7852b855"
        }
      },
      "summary": "passed; observed duration=178ms; stdout=10981 bytes; stderr=0 bytes"
    },
    {
      "id": "docs-policy",
      "executable": "npm",
      "args": [
        "run",
        "test:repository"
      ],
      "display": "[\"npm\",\"run\",\"test:repository\"]",
      "timeoutMs": 300000,
      "exitCode": 0,
      "signal": null,
      "status": "passed",
      "observedDurationMs": 465,
      "durationVerification": {
        "mode": "replay-envelope-v1",
        "factor": 4,
        "slackMs": 1000
      },
      "stdout": {
        "observed": {
          "bytes": 29131,
          "sha256": "ee1121b65d52a16ffdff3c4940b40e02001d4cbf839e762abb85f35744be4ef4"
        },
        "replay": {
          "normalization": "ascii-digit-runs-v1",
          "bytes": 28864,
          "sha256": "496e6687405b508e34a1653cc5c4fd61879330cd0f27242695f79b5c104cdd35"
        }
      },
      "stderr": {
        "observed": {
          "bytes": 0,
          "sha256": "e3b0c44298fc1c149afbf4c8996fb92427ae41e4649b934ca495991b7852b855"
        },
        "replay": {
          "normalization": "ascii-digit-runs-v1",
          "bytes": 0,
          "sha256": "e3b0c44298fc1c149afbf4c8996fb92427ae41e4649b934ca495991b7852b855"
        }
      },
      "summary": "passed; observed duration=465ms; stdout=29131 bytes; stderr=0 bytes"
    },
    {
      "id": "static",
      "executable": "npm",
      "args": [
        "run",
        "static"
      ],
      "display": "[\"npm\",\"run\",\"static\"]",
      "timeoutMs": 900000,
      "exitCode": 0,
      "signal": null,
      "status": "passed",
      "observedDurationMs": 8078,
      "durationVerification": {
        "mode": "replay-envelope-v1",
        "factor": 4,
        "slackMs": 1000
      },
      "stdout": {
        "observed": {
          "bytes": 31502,
          "sha256": "4eb567b65de5d040b27ec96f470ce8c2eec330920b5f3e53b19dcda5763955fa"
        },
        "replay": {
          "normalization": "ascii-digit-runs-v1",
          "bytes": 31235,
          "sha256": "f0da291b03d6be4c8b201dbce08933535cc34d3a946449138ebea595bafa1721"
        }
      },
      "stderr": {
        "observed": {
          "bytes": 0,
          "sha256": "e3b0c44298fc1c149afbf4c8996fb92427ae41e4649b934ca495991b7852b855"
        },
        "replay": {
          "normalization": "ascii-digit-runs-v1",
          "bytes": 0,
          "sha256": "e3b0c44298fc1c149afbf4c8996fb92427ae41e4649b934ca495991b7852b855"
        }
      },
      "summary": "passed; observed duration=8078ms; stdout=31502 bytes; stderr=0 bytes"
    },
    {
      "id": "unit-contract",
      "executable": "npm",
      "args": [
        "run",
        "test:unit"
      ],
      "display": "[\"npm\",\"run\",\"test:unit\"]",
      "timeoutMs": 1200000,
      "exitCode": 0,
      "signal": null,
      "status": "passed",
      "observedDurationMs": 19698,
      "durationVerification": {
        "mode": "replay-envelope-v1",
        "factor": 4,
        "slackMs": 1000
      },
      "stdout": {
        "observed": {
          "bytes": 230130,
          "sha256": "6ffc378ab9a03e6eae670219d3fee826cf04f6b6518fb737cbbf20228c06f01a"
        },
        "replay": {
          "normalization": "ascii-digit-runs-v1",
          "bytes": 228381,
          "sha256": "65a2e380b51a0abfa50e80dcc51d31ae66dfcc8ffe49ae0c6facabd9cd420b76"
        }
      },
      "stderr": {
        "observed": {
          "bytes": 0,
          "sha256": "e3b0c44298fc1c149afbf4c8996fb92427ae41e4649b934ca495991b7852b855"
        },
        "replay": {
          "normalization": "ascii-digit-runs-v1",
          "bytes": 0,
          "sha256": "e3b0c44298fc1c149afbf4c8996fb92427ae41e4649b934ca495991b7852b855"
        }
      },
      "summary": "passed; observed duration=19698ms; stdout=230130 bytes; stderr=0 bytes"
    },
    {
      "id": "package-smoke",
      "executable": "npm",
      "args": [
        "run",
        "test",
        "--workspace",
        "@zachshotamartin/robin"
      ],
      "display": "[\"npm\",\"run\",\"test\",\"--workspace\",\"@zachshotamartin/robin\"]",
      "timeoutMs": 900000,
      "exitCode": 0,
      "signal": null,
      "status": "passed",
      "observedDurationMs": 5016,
      "durationVerification": {
        "mode": "replay-envelope-v1",
        "factor": 4,
        "slackMs": 1000
      },
      "stdout": {
        "observed": {
          "bytes": 34222,
          "sha256": "8d704a788f3a48d5596b616f4ee98463294e6c65592033a2e644a7c05494ff3a"
        },
        "replay": {
          "normalization": "ascii-digit-runs-v1",
          "bytes": 33933,
          "sha256": "278573a7a7b908308d1dfa05f2a107c5a5e81fc4fdc00bb86793a5e91951d067"
        }
      },
      "stderr": {
        "observed": {
          "bytes": 0,
          "sha256": "e3b0c44298fc1c149afbf4c8996fb92427ae41e4649b934ca495991b7852b855"
        },
        "replay": {
          "normalization": "ascii-digit-runs-v1",
          "bytes": 0,
          "sha256": "e3b0c44298fc1c149afbf4c8996fb92427ae41e4649b934ca495991b7852b855"
        }
      },
      "summary": "passed; observed duration=5016ms; stdout=34222 bytes; stderr=0 bytes"
    },
    {
      "id": "gate-a",
      "executable": "npm",
      "args": [
        "run",
        "test:gate:a"
      ],
      "display": "[\"npm\",\"run\",\"test:gate:a\"]",
      "timeoutMs": 1200000,
      "exitCode": 0,
      "signal": null,
      "status": "passed",
      "observedDurationMs": 24823,
      "durationVerification": {
        "mode": "replay-envelope-v1",
        "factor": 4,
        "slackMs": 1000
      },
      "stdout": {
        "observed": {
          "bytes": 253815,
          "sha256": "b7c723f9bd758a8f710004e7ab983198317dc1bb67c06d005606daa919c31526"
        },
        "replay": {
          "normalization": "ascii-digit-runs-v1",
          "bytes": 251852,
          "sha256": "70694c6b5bad49bbee0f46ad183ec27a9da9968398bb2f9f5bab3dd2b8a62b78"
        }
      },
      "stderr": {
        "observed": {
          "bytes": 0,
          "sha256": "e3b0c44298fc1c149afbf4c8996fb92427ae41e4649b934ca495991b7852b855"
        },
        "replay": {
          "normalization": "ascii-digit-runs-v1",
          "bytes": 0,
          "sha256": "e3b0c44298fc1c149afbf4c8996fb92427ae41e4649b934ca495991b7852b855"
        }
      },
      "summary": "passed; observed duration=24823ms; stdout=253815 bytes; stderr=0 bytes"
    },
    {
      "id": "gate-b",
      "executable": "npm",
      "args": [
        "run",
        "test:gate:b"
      ],
      "display": "[\"npm\",\"run\",\"test:gate:b\"]",
      "timeoutMs": 3600000,
      "exitCode": 0,
      "signal": null,
      "status": "passed",
      "observedDurationMs": 40923,
      "durationVerification": {